{
  "source_name": "NY Fed Repo Operations",
  "source_domain": "nyfed.gov",
  "records_seen": 2,
  "accepted_count": 0,
  "review_count": 0,
  "rejected_count": 2,
  "filtered_out_count": 0,
  "accepted_ratio": 0.0,
  "review_ratio": 0.0,
  "rejected_ratio": 1.0,
  "filtered_ratio": 0.0,
  "avg_priority_score": 0.0,
  "avg_verification_confidence": 0.0,
  "last_seen_at": "2026-04-01T14:47:20.929365+00:00"
}