{
  "source_name": "Chicago Fed Insights",
  "source_domain": "chicagofed.org",
  "records_seen": 6,
  "accepted_count": 0,
  "review_count": 0,
  "rejected_count": 0,
  "filtered_out_count": 6,
  "accepted_ratio": 0.0,
  "review_ratio": 0.0,
  "rejected_ratio": 0.0,
  "filtered_ratio": 1.0,
  "avg_priority_score": 0.0,
  "avg_verification_confidence": 0.0,
  "last_seen_at": ""
}